{"summary_zh":"本步骤仅汇总当前 run 前 7 个上游 step 的输出。7 个上游 step 均为 RED，且每个 step 均有 1 项需人工审核/阻塞项；因此整体仍为草稿状态，需要人工补充与复核，不能提交。","confirmed_facts":["release-build-agent 当前 run readiness=RED，blockers=1，human_review_count=1。","privacy-disclosure-prep 当前 run readiness=RED，blockers=1，human_review_count=1。","google-play-listing 当前 run readiness=RED，blockers=1，human_review_count=1。","screenshot-storyboard 当前 run readiness=RED，blockers=1，human_review_count=1。","launch-info-collector 当前 run readiness=RED，blockers=1，human_review_count=1。","google-data-safety-agent 当前 run readiness=RED，blockers=1，human_review_count=1。","screenshot-capture-agent 当前 run readiness=RED，blockers=1，human_review_count=1。"],"risks":["所有 7 个上游 step 均为 RED，不能视为工程、隐私、商店文案、截图、发布信息、Data Safety 或截图采集已通过。","每个上游 step 均存在 1 项阻塞/人工审核项，缺口未关闭前不能进入提交动作。","本汇总不得补充上游 evidence 未支持的事实，因此未知、缺失、需人工审核的信息仍保持原状态。"],"human_review_items":["人工复核 release-build-agent 的 1 项阻塞/审核项。","人工复核 privacy-disclosure-prep 的 1 项阻塞/审核项。","人工复核 google-play-listing 的 1 项阻塞/审核项。","人工复核 screenshot-storyboard 的 1 项阻塞/审核项。","人工复核 launch-info-collector 的 1 项阻塞/审核项。","人工复核 google-data-safety-agent 的 1 项阻塞/审核项。","人工复核 screenshot-capture-agent 的 1 项阻塞/审核项。"],"next_steps":["逐项关闭 7 个上游 step 标记的阻塞/人工审核项。","在上游 step 重新产出当前 run evidence 后，再重新汇总整体状态。","保持当前汇总为草稿证据包，不进行 Play Store 提交流程。"],"evidence_ids_used":["launch-package-agent.evidence.01","launch-package-agent.evidence.02","launch-package-agent.evidence.03","launch-package-agent.evidence.04","launch-package-agent.evidence.05","launch-package-agent.evidence.06","launch-package-agent.evidence.07"]}