{"summary_zh":"当前仅确认既有上架文案文件与校验报告均缺失，因此只能给出无功能声称的占位草稿：标题草稿为“杂志摘要”；短描述草稿为“阅读与整理杂志内容摘要。”；完整描述草稿为“杂志摘要用于呈现杂志内容摘要，帮助用户查看整理后的阅读内容。实际功能、数据来源、目标地区、隐私说明与合规表述仍需人工基于当前应用证据补充和审核。本内容仍为草稿，不能提交。”","confirmed_facts":["缺少 en-US 上架文案文件 docs/launch/google-play/listing.en-US.json。","缺少 zh-CN 上架文案文件 docs/launch/google-play/listing.zh-CN.json。","缺少 listing validation report 文件 docs/launch/google-play/listing-validation-report.md。"],"risks":["当前证据不足，无法确认应用正式名称、核心功能、目标用户、地区、隐私说明或合规文案。","任何更具体的营销描述、功能承诺或质量表述都缺少本轮证据支撑。","缺少校验报告，无法确认文案长度、敏感词、政策风险或本地化一致性。"],"human_review_items":["确认应用在 Play Store 使用的正式名称。","补充当前应用真实功能、内容来源、账号体系、数据处理与隐私政策依据。","人工审核 title、short description、full description 是否符合 Play Store 政策与实际产品表现。"],"next_steps":["基于当前应用证据创建 en-US 与 zh-CN 上架文案草稿文件。","生成 listing validation report，记录长度检查、证据映射与需人工审核项。","在隐私披露和发布构建信息明确后，再扩展文案内容，避免无证据声称。"],"evidence_ids_used":["google-play-listing.evidence.01","google-play-listing.evidence.02","google-play-listing.evidence.03"]}