{"summary_zh":"隐私披露准备阶段当前只能确认三项关键隐私材料均缺失，因此本轮不能形成可用于上架表单填写的披露结论。输出仅为草稿风险归纳与人工补充清单，不构成法律或隐私合规结论。","confirmed_facts":["缺少数据清单文件：docs/privacy/DATA_INVENTORY.md。","缺少 SDK 清单文件：docs/privacy/SDK_INVENTORY.md。","缺少隐私披露草稿文件：docs/launch/privacy/privacy-disclosure-draft.md。"],"risks":["数据收集、使用、共享、保留与删除机制均无法基于当前证据确认。","第三方 SDK、分析、广告、崩溃收集、网络服务等隐私相关依赖无法基于当前证据确认。","无法据此判断 Google Play 数据安全表单中各项选择是否准确。","如在缺少清单与披露草稿的情况下继续填写，存在遗漏、误报或与实际行为不一致的风险。"],"human_review_items":["补充 docs/privacy/DATA_INVENTORY.md，逐项列明应用收集或处理的数据类型、用途、是否共享、是否可删除。","补充 docs/privacy/SDK_INVENTORY.md，列明所有第三方 SDK、用途、数据访问面、供应商政策链接与是否默认启用。","补充 docs/launch/privacy/privacy-disclosure-draft.md，汇总拟用于 Google Play 数据安全与隐私政策核对的草稿内容。","由产品、工程与法律/隐私负责人共同审核数据清单、SDK 清单和披露草稿的一致性。"],"next_steps":["先完成数据清单与 SDK 清单的当前版本。","基于清单生成隐私披露草稿，并保留证据编号映射。","完成跨职能人工审核后，再进入后续上架材料整理步骤。"],"evidence_ids_used":["privacy-disclosure-prep.evidence.01","privacy-disclosure-prep.evidence.02","privacy-disclosure-prep.evidence.03"]}